<Payload xmlns="http://javaops.ru"
         xmlns:xsi="http://www.w3.org/2001/XMLSchema-instance"
         xsi:schemaLocation="http://javaops.ru payload.xsd">
    <Users>
        <User flag="active" city="kiv" email="gmail@gmail.com" groups="topjava07 masterjava01">
            <fullName>Full Name</fullName>
        </User>
        <User flag="superuser" city="spb" email="admin@javaops.ru" groups="topjava07 topjava08 masterjava01">
            <fullName>Admin</fullName>
        </User>
        <User flag="deleted" city="spb" email="mail@yandex.ru" groups="masterjava01">
            <fullNae>Deleted</fullNae>
        </User>
    </Users>
    <Cities>
        <City id="spb">Санкт-Петербург</City>
        <City id="kiv">Киев</City>
        <City id="mnsk">Минск</City>
    </Cities>
    <Projects>
        <Project id="topjava">
            <Name>TopJava</Name>
            <Description>Java EE project</Description>
        </Project>
        <Project id="masterjava">
              <Name>MasterJava</Name>
            <Description>Java EE project+</Description>
        </Project>
    </Projects>
    <Groups